{
  "id": "curl",
  "name": "cURL",
  "description": "Shapes adapter for curl — transfer data with URLs",
  "author": "patrick-hofmann",
  "category": "infrastructure",
  "tags": ["curl", "http", "api", "network", "download"],
  "executable": "curl",
  "risk_summary": "Makes network requests and can write downloaded files to disk",
  "min_shapes_version": "0.2.0"
}
