{
  "id": "tar",
  "name": "Tar",
  "description": "Shapes adapter for tar — create, extract, and list tar archives",
  "author": "patrick-hofmann",
  "category": "other",
  "tags": ["tar", "archive", "compress", "coreutils"],
  "executable": "tar",
  "risk_summary": "Creates and extracts archives which can overwrite existing files",
  "min_shapes_version": "0.2.0"
}
