{
  "id": "echo",
  "name": "Echo",
  "description": "Shapes adapter for echo — print messages to stdout",
  "author": "patrick-hofmann",
  "category": "other",
  "tags": ["echo", "print", "output", "coreutils"],
  "executable": "echo",
  "risk_summary": "All operations are read-only (stdout). No side effects.",
  "min_shapes_version": "0.2.0"
}
