{
  "id": "git",
  "name": "Git Version Control",
  "description": "Shapes adapter for git — declared options, git -C, read-only replay, exact rebase and push",
  "author": "delta-mind",
  "category": "devtools",
  "tags": ["git", "version-control", "scm", "repositories"],
  "executable": "git",
  "risk_summary": "Reads are low-risk; commit is medium; push, merge, reset and rebase are high-risk, and rebase onto an upstream and push of a refspec are bound to the exact command. Undeclared options never match.",
  "homepage": "https://git-scm.com",
  "min_shapes_version": "0.10.0"
}
