{
  "id": "awk",
  "name": "AWK",
  "description": "Shapes adapter for awk — pattern scanning and text processing",
  "author": "patrick-hofmann",
  "category": "other",
  "tags": ["awk", "process", "pattern", "text", "coreutils"],
  "executable": "awk",
  "risk_summary": "All operations are read-only. No side effects.",
  "min_shapes_version": "0.2.0"
}
