{
  "id": "chmod",
  "name": "Change File Permissions",
  "description": "Shapes adapter for chmod — change file and directory permissions",
  "author": "patrick-hofmann",
  "category": "other",
  "tags": ["chmod", "permissions", "security", "files", "coreutils"],
  "executable": "chmod",
  "risk_summary": "All operations modify file permissions. Single-file is high-risk, recursive is critical.",
  "min_shapes_version": "0.2.0"
}
