{
  "id": "mkdir",
  "name": "Make Directory",
  "description": "Shapes adapter for mkdir — create directories",
  "author": "patrick-hofmann",
  "category": "other",
  "tags": ["mkdir", "directory", "create", "coreutils"],
  "executable": "mkdir",
  "risk_summary": "Creates new directories. No destructive side effects.",
  "min_shapes_version": "0.2.0"
}
